<?xml version="1.0" encoding="UTF-8"?>
<book xmlns:xs="http://www.w3.org/2001/XMLSchema-instance" xs:noNamespaceSchemaLocation="book.xsd">
    <title>Moby Dick</title>
    <author>
        <given-name>Herman</given-name>
        <middle-name>J. L.</middle-name>
        <last-name>Melville</last-name>
    </author>
    <print>5-5-1927</print>
    <pages>814</pages>
    <description>
Das erzhlerische Rueckgrat des Romans ist
die schicksalhafte Fahrt des Walfangschiffes
Pequod, dessen Kapitaen Ahab mit blindem Hass
den weissen Pottwal Moby Dick jagt, der ihm
ein Bein abgerissen hat.
    </description>
    <literature>
        <symbol>
    Ahabs Jagd auf den Weissen Wal steht im
    Widerspruch zu den materiellen Interessen
    von Mannschaft und Eignern. Dem Ersten
    Maat Starbuck erscheint Ahabs Rachsucht
    gegen das unvernuenftige Tier Moby Dick
    gotteslaesterlich.
        </symbol>
    </literature>
</book>